{
  "schema_version": "ordin.command_card.v1",
  "command": "mv",
  "summary": "Move or rename files and directories.",
  "aliases": ["move file", "rename file"],
  "intents": [
    "rename a file",
    "move a file",
    "move a directory"
  ],
  "default_risk": "medium",
  "risk_tags": ["filesystem_write"],
  "examples": [
    {
      "command": "mv old-name.txt new-name.txt",
      "explanation": "Rename a file."
    }
  ],
  "templates": [
    {
      "command": "mv {path} <destination>",
      "description": "Move or rename a path."
    }
  ]
}
