{
  "schema_version": "ordin.command_card.v1",
  "command": "ss",
  "summary": "Inspect sockets and network connections.",
  "aliases": ["socket statistics", "port", "listening"],
  "intents": [
    "show listening ports",
    "find open sockets",
    "debug network listeners"
  ],
  "default_risk": "low",
  "risk_tags": ["inspection", "network_metadata"],
  "examples": [
    {
      "command": "ss -ltnp",
      "explanation": "List listening TCP sockets with process information."
    }
  ],
  "templates": [
    {
      "command": "ss -ltnp",
      "description": "List listening TCP sockets with process information."
    }
  ]
}
