{
  "schema_version": "ordin.command_card.v1",
  "command": "zip",
  "summary": "Create zip archives.",
  "aliases": ["compress zip", "archive folder", "zip folder"],
  "intents": ["zip a folder", "compress files", "create zip archive"],
  "default_risk": "medium",
  "risk_tags": ["filesystem_write", "archive_create"],
  "examples": [{"command": "zip -r archive.zip folder/", "explanation": "Create a zip archive from a folder."}],
  "templates": [{"command": "zip -r archive.zip {path}", "description": "Create a zip archive from a path."}]
}
