{
  "schema_version": "ordin.command_card.v1",
  "command": "dig",
  "summary": "Query DNS records.",
  "aliases": ["dns lookup", "domain lookup", "dns records"],
  "intents": ["lookup dns records", "check domain dns", "find ip for domain"],
  "default_risk": "low",
  "risk_tags": ["network_access", "inspection"],
  "examples": [{"command": "dig example.com", "explanation": "Query DNS records for example.com."}],
  "templates": [{"command": "dig {host}", "description": "Query DNS records for a host."}]
}
